date,source,url,title,done
2025-03-05,decrypt,https://decrypt.co/308748/brother-australian-olympic-breakdancer-raygun-crypto-fraud,Brother of Australian Olympic Breakdancer ‘Raygun’ Charged With Crypto Fraud
2025-03-20,decrypt,https://decrypt.co/310819/authorities-target-crypto-scammers-posing-binance-australia,Authorities Target Crypto Scammers Posing as Binance in Australia
2025-03-31,decrypt,https://decrypt.co/312354/australia-crypto-atm-providers-money-laundering,Australia Puts Crypto ATM Providers 'On Notice' Over Money Laundering Concerns
2025-04-10,decrypt,https://decrypt.co/314261/australian-bank-ceo-apologises-freezing-customer-funds-bitcoin-transfer,Major Australian Bank CEO Apologises After Freezing Customer Funds Over Bitcoin Transfer
2025-04-10,decrypt,https://decrypt.co/314259/sharering-trial-blockchain-id-australian-government-age-verification-push,ShareRing to Trial Blockchain ID in Australian Government Age Verification Push
2025-04-16,decrypt,https://decrypt.co/315022/coinbase-urges-australia-vote-crypto-progress-may,Coinbase Urges Australia to Vote for Crypto Progress in May
2025-04-22,decrypt,https://decrypt.co/315726/australian-federal-court-backs-crypto-lender-in-landmark-win-over-asic,Australian Federal Court Backs Crypto Lender in Landmark Win Over ASIC
2025-04-29,decrypt,https://decrypt.co/316842/use-it-or-lose-it-australian-watchdog-cracks-down-on-dormant-crypto-exchanges,'Use It or Lose It': Australian Watchdog Cracks Down on Dormant Crypto Exchanges
